2021,1904.0,FACULDADE SÃO CAMILO,FASC,Faculdade,Privada sem fins lucrativos,RJ,2.0,1.0,2.056,0.0,0.0,0.0,0.0,2.056,3,
2021,1906.0,INSTITUTO DE ENSINO SUPERIOR MATERDEI,IES-MATERDEI,Faculdade,Privada com fins lucrativos,AM,1.0,1.0,2.816,0.0,0.0,0.0,0.0,2.816,3,
2021,1907.0,FACULDADE EDUCACIONAL DE COLOMBO,FAEC,Faculdade,Privada com fins lucrativos,PR,8.0,1.0,1.959,0.0,0.0,0.0,0.0,1.959,3,
2021,1908.0,ESCOLA DE ENSINO SUPERIOR FABRA,FABRA,Faculdade,Privada sem fins lucrativos,ES,12.0,1.0,2.648,0.0,0.0,0.0,0.0,2.648,3,
2021,1909.0,FACULDADES DOCTUM DE IPATINGA,,Faculdade,Privada sem fins lucrativos,MG,1.0,1.0,1.276,0.0,0.0,0.0,0.0,1.276,2,
2021,1910.0,FACULDADE UNINASSAU LAURO DE FREITAS,,Faculdade,Privada com fins lucrativos,BA,13.0,1.0,2.822,0.0,0.0,0.0,0.0,2.822,3,
2021,1913.0,CENTRO UNIVERSITÁRIO FAMINAS,UNIFAMINAS,Centro Universitário,Privada com fins lucrativos,MG,14.0,1.0,2.995,0.0,0.0,0.0,0.0,2.995,4,
2021,1917.0,Centro Universitário Unifacimed,UNIFACIMED,Centro Universitário,Privada com fins lucrativos,RO,11.0,1.0,2.267,0.0,0.0,0.0,0.0,2.267,3,
2021,1918.0,FACULDADE CAPIVARI,FUCAP,Faculdade,Privada com fins lucrativos,SC,9.0,1.0,2.338,0.0,0.0,0.0,0.0,2.338,3,
2021,1921.0,FACULDADE DE SÃO BENTO,FSB,Faculdade,Privada sem fins lucrativos,SP,3.0,1.0,2.877,0.0,0.0,0.0,0.0,2.877,3,
2021,1923.0,FACULDADE DE DIREITO PADRE ARNALDO JANSSEN,FAJANSSEN,Faculdade,Privada sem fins lucrativos,MG,13.0,1.0,2.409,0.0,0.0,0.0,0.0,2.409,3,
2021,1926.0,FACULDADE DE ADMINISTRAÇÃO DE CATAGUASES,UNIPACAT,Faculdade,Privada sem fins lucrativos,MG,1.0,1.0,3.201,0.0,0.0,0.0,0.0,3.201,4,
2021,1927.0,CENTRO UNIVERSITÁRIO DO VALE DO IGUAÇU,UNIGUAÇU,Centro Universitário,Privada com fins lucrativos,PR,19.0,1.0,3.035,0.0,0.0,0.0,0.0,3.035,4,
2021,1928.0,FACULDADE CNEC ILHA DO GOVERNADOR,,Faculdade,Privada sem fins lucrativos,RJ,2.0,1.0,2.528,0.0,0.0,0.0,0.0,2.528,3,
2021,1930.0,INSTITUTO SUPERIOR DE EDUCAÇÃO DE SÃO PAULO,SINGULARIDADES/ISESP,Faculdade,Privada sem fins lucrativos,SP,3.0,1.0,3.482,0.0,0.0,0.0,0.0,3.482,4,
2021,1931.0,INSTITUTO DE ENSINO SUPERIOR FRANCISCANO,IESF,Faculdade,Privada com fins lucrativos,MA,6.0,1.0,2.625,0.0,0.0,0.0,0.0,2.625,3,
2021,1932.0,FACULDADE PALOTINA,FAPAS,Faculdade,Privada sem fins lucrativos,RS,4.0,1.0,2.489,0.0,0.0,0.0,0.0,2.489,3,
2021,1933.0,FACULDADE BIRIGUI,FABI,Faculdade,Privada com fins lucrativos,SP,2.0,1.0,1.749,0.0,0.0,0.0,0.0,1.749,2,
2021,1934.0,FACULDADE SINOP,FASIP,Faculdade,Privada com fins lucrativos,MT,3.0,1.0,2.388,0.0,0.0,0.0,0.0,2.388,3,
2021,1936.0,CENTRO UNIVERSITÁRIO LA SALLE,UNILASALLE - LUCAS,Centro Universitário,Privada sem fins lucrativos,MT,7.0,1.0,2.281,0.0,0.0,0.0,0.0,2.281,3,
2021,1937.0,FACULDADE EVANGÉLICA DE SALVADOR,FACESA,Faculdade,Privada com fins lucrativos,BA,1.0,,,,,,,,SC,Quantidade de matrículas igual a zero.
2021,1939.0,INSTITUTO DE ENSINO SUPERIOR DE LONDRINA - INESUL,INESUL,Faculdade,Privada com fins lucrativos,PR,12.0,1.0,1.824,0.0,0.0,0.0,0.0,1.824,2,
2021,1940.0,FACULDADE DE NOVA SERRANA,FANS,Faculdade,Privada sem fins lucrativos,MG,3.0,1.0,3.037,0.0,0.0,0.0,0.0,3.037,4,
2021,1941.0,FACULDADE CUIABÁ,FAUC,Faculdade,Privada sem fins lucrativos,MT,6.0,1.0,1.724,0.0,0.0,0.0,0.0,1.724,2,
2021,1944.0,FACULDADE DE TECNOLOGIA IBRATEC,IBRATEC,Faculdade,Privada com fins lucrativos,PE,3.0,1.0,1.273,0.0,0.0,0.0,0.0,1.273,2,
2021,1945.0,FACULDADE DE SORRISO,,Faculdade,Privada com fins lucrativos,MT,8.0,1.0,2.245,0.0,0.0,0.0,0.0,2.245,3,
2021,1946.0,FACULDADE LEGALE,FALEG,Faculdade,Privada com fins lucrativos,SP,1.0,1.0,2.473,0.0,0.0,0.0,0.0,2.473,3,
2021,1948.0,FACULDADE DE ENSINO SUPERIOR DA PARAÍBA,FESP,Faculdade,Privada com fins lucrativos,PB,1.0,1.0,1.989,0.0,0.0,0.0,0.0,1.989,3,
2021,1949.0,CENTRO UNIVERSITÁRIO DE PAULÍNIA,UNIFACP,Centro Universitário,Privada com fins lucrativos,SP,12.0,1.0,1.87,0.0,0.0,0.0,0.0,1.87,2,
2021,1952.0,CENTRO UNIVERSITÁRIO CATHEDRAL,,Centro Universitário,Privada com fins lucrativos,MT,9.0,1.0,3.293,0.0,0.0,0.0,0.0,3.293,4,
2021,1956.0,FACULDADE UNIRB - ALAGOAS,F.UNIRB,Faculdade,Privada sem fins lucrativos,AL,2.0,1.0,2.694,0.0,0.0,0.0,0.0,2.694,3,
2021,1957.0,FACULDADE DE TECNOLOGIA SENAI JOINVILLE,SENAI DE JOINVILLE,Faculdade,Privada sem fins lucrativos,SC,1.0,1.0,2.435,0.0,0.0,0.0,0.0,2.435,3,
2021,1958.0,FACULDADE DE TECNOLOGIA SENAI BLUMENAU,CET BLUMENAU,Faculdade,Privada sem fins lucrativos,SC,2.0,1.0,1.727,0.0,0.0,0.0,0.0,1.727,2,
2021,1961.0,INSTITUTO TECNOLÓGICO E DAS CIÊNCIAS SOCIAIS APLICADAS E DA SAÚDE DO CENTRO EDUC. N. SRª AUXILIADORA,ITCSAS/CENSA,Faculdade,Privada sem fins lucrativos,RJ,9.0,1.0,2.673,0.0,0.0,0.0,0.0,2.673,3,
2021,1962.0,INSTITUTO SUPERIOR DE EDUCAÇÃO DO CENTRO EDUCACIONAL NOSSA SENHORA AUXILIADORA,ISECENSA,Faculdade,Privada sem fins lucrativos,RJ,1.0,1.0,3.15,0.0,0.0,0.0,0.0,3.15,4,
2021,1964.0,"FACULDADE DE TECNOLOGIA EM HOTELARIA, GASTRONOMIA E TURISMO DE SÃO PAULO",HOTEC,Faculdade,Privada com fins lucrativos,SP,3.0,1.0,2.135,0.0,0.0,0.0,0.0,2.135,3,
2021,1965.0,Centro Universitário Mario Pontes Jucá,UMJ,Centro Universitário,Privada sem fins lucrativos,AL,12.0,1.0,2.469,0.0,0.0,0.0,0.0,2.469,3,
2021,1967.0,FACULDADE DO VALE DO ITAPECURÚ,FAI,Faculdade,Privada com fins lucrativos,MA,3.0,1.0,2.209,0.0,0.0,0.0,0.0,2.209,3,
2021,1970.0,Faculdade Multivix de Cachoeiro,Multivix Cachoeiro,Faculdade,Privada com fins lucrativos,ES,5.0,1.0,4.164,0.0,0.0,0.0,0.0,4.164,5,
2021,1977.0,CENTRO DE ESTUDOS SUPERIORES APRENDIZ,CESA,Faculdade,Privada com fins lucrativos,MG,1.0,1.0,2.232,0.0,0.0,0.0,0.0,2.232,3,
2021,1978.0,Centro Universitário Fametro, Unifametro,Centro Universitário,Privada com fins lucrativos,CE,19.0,1.0,3.506,0.0,0.0,0.0,0.0,3.506,4,
2021,1980.0,FACULDADE SINERGIA,SINERGIA,Faculdade,Privada com fins lucrativos,SC,3.0,1.0,2.725,0.0,0.0,0.0,0.0,2.725,3,
2021,1984.0,Centro Universitário Unifacig,,Centro Universitário,Privada com fins lucrativos,MG,10.0,1.0,2.95,0.0,0.0,0.0,0.0,2.95,4,
2021,1986.0,CENTRO UNIVERSITÁRIO ESTÁCIO JUIZ DE FORA - ESTÁCIO JUIZ DE FORA,,Centro Universitário,Privada com fins lucrativos,MG,18.0,1.0,2.62,0.0,0.0,0.0,0.0,2.62,3,
2021,1988.0,CENTRO UNIVERSITARIO AVANTIS,UNIAVAN,Centro Universitário,Privada com fins lucrativos,SC,13.0,1.0,2.902,0.0,0.0,0.0,0.0,2.902,3,
2021,1995.0,FACULDADE DE MEDICINA NOVA ESPERANÇA,FAMENE,Faculdade,Privada com fins lucrativos,PB,1.0,1.0,3.421,0.0,0.0,0.0,0.0,3.421,4,
2021,1996.0,INSTITUTO CUIABÁ DE ENSINO E CULTURA,ICEC,Faculdade,Privada com fins lucrativos,MT,11.0,1.0,1.803,0.0,0.0,0.0,0.0,1.803,2,
2021,1998.0,INSTITUTO SUPERIOR DE EDUCAÇÃO ELVIRA DAYRELL,ISEED,Faculdade,Privada com fins lucrativos,MG,2.0,1.0,1.324,0.0,0.0,0.0,0.0,1.324,2,
2021,2005.0,FACULDADE DE CIÊNCIAS SOCIAIS APLICADAS DE SINOP,FACISAS,Faculdade,Privada com fins lucrativos,MT,10.0,1.0,2.529,0.0,0.0,0.0,0.0,2.529,3,
2021,2009.0,FACULDADE DE TAQUARITINGA,FTGA,Faculdade,Privada com fins lucrativos,SP,3.0,1.0,1.73,0.0,0.0,0.0,0.0,1.73,2,
2021,2015.0,INSTITUTO SANTO TOMÁS DE AQUINO,ISTA,Faculdade,Privada sem fins lucrativos,MG,3.0,1.0,3.413,0.0,0.0,0.0,0.0,3.413,4,
2021,2021.0,FACULDADE JK - UNIDADE II - GAMA,,Faculdade,Privada com fins lucrativos,DF,3.0,1.0,2.782,0.0,0.0,0.0,0.0,2.782,3,
2021,2022.0,FACULDADE DE ROLIM DE MOURA,FAROL,Faculdade,Privada com fins lucrativos,RO,2.0,1.0,2.398,0.0,0.0,0.0,0.0,2.398,3,
2021,2023.0,Centro Universitário FG,UNIFG,Centro Universitário,Privada com fins lucrativos,BA,12.0,0.983,2.652,0.016,4.0,0.0,0.0,2.674,3,
2021,2027.0,FACULDADE DE CAMPINA GRANDE,FAC-CG,Faculdade,Privada com fins lucrativos,PB,6.0,1.0,2.099,0.0,0.0,0.0,0.0,2.099,3,
2021,2035.0,FACULDADE FATIFAJAR JAGUARIAÍVA,FAJAR,Faculdade,Privada com fins lucrativos,PR,2.0,1.0,2.145,0.0,0.0,0.0,0.0,2.145,3,
2021,2036.0,Faculdade Estácio do Pará - Estácio FAP,ESTÁCIO FAP,Faculdade,Privada com fins lucrativos,PA,7.0,1.0,2.652,0.0,0.0,0.0,0.0,2.652,3,
2021,2037.0,FACULDADE UNIME DE CIÊNCIAS EXATAS E TECNOLÓGICAS,FCT,Faculdade,Privada com fins lucrativos,BA,6.0,1.0,2.667,0.0,0.0,0.0,0.0,2.667,3,
2021,2039.0,FACULDADE CIDADE LUZ,FACILUZ,Faculdade,Privada com fins lucrativos,SP,1.0,1.0,2.078,0.0,0.0,0.0,0.0,2.078,3,
2021,2040.0,FACULDADE DO FUTURO,FAF,Faculdade,Privada com fins lucrativos,MG,5.0,1.0,2.596,0.0,0.0,0.0,0.0,2.596,3,
2021,2041.0,FACULDADE SUDAMÉRICA,SUDAMÉRICA,Faculdade,Privada sem fins lucrativos,MG,4.0,1.0,1.922,0.0,0.0,0.0,0.0,1.922,2,
2021,2042.0,FACULDADE FIGUEIREDO COSTA - FIC,,Faculdade,Privada com fins lucrativos,AL,5.0,1.0,2.541,0.0,0.0,0.0,0.0,2.541,3,
2021,2043.0,CENTRO UNIVERSITÁRIO VALE DO SALGADO,,Centro Universitário,Privada com fins lucrativos,CE,8.0,1.0,3.412,0.0,0.0,0.0,0.0,3.412,4,
2021,2045.0,FACULDADE AMADEUS,FAMA,Faculdade,Privada com fins lucrativos,SE,3.0,1.0,2.627,0.0,0.0,0.0,0.0,2.627,3,
2021,2049.0,INSTITUTO DE ESTUDOS SUPERIORES DO MARANHÃO,IESMA,Faculdade,Privada sem fins lucrativos,MA,1.0,1.0,2.473,0.0,0.0,0.0,0.0,2.473,3,
2021,2054.0,FACULDADE DE EDUCAÇÃO DE NOVA ANDRADINA,FENA,Faculdade,Privada sem fins lucrativos,MS,1.0,1.0,2.393,0.0,0.0,0.0,0.0,2.393,3,
2021,2056.0,FACULDADE DA ALTA PAULISTA,FAP,Faculdade,Privada com fins lucrativos,SP,5.0,1.0,2.499,0.0,0.0,0.0,0.0,2.499,3,
2021,2058.0,FACULDADE METROPOLITANA,UNNESA,Faculdade,Privada com fins lucrativos,RO,6.0,1.0,2.572,0.0,0.0,0.0,0.0,2.572,3,
2021,2067.0,FACULDADE DE CIÊNCIAS E EMPREENDEDORISMO,FACEMP,Faculdade,Privada com fins lucrativos,BA,9.0,1.0,2.581,0.0,0.0,0.0,0.0,2.581,3,
2021,2072.0,FACULDADE DE DESENVOLVIMENTO SUSTENTÁVEL DE CRUZEIRO DO SUL,IEVAL,Faculdade,Privada sem fins lucrativos,AC,1.0,1.0,2.158,0.0,0.0,0.0,0.0,2.158,3,
2021,2076.0,CENTRO UNIVERSITÁRIO UNIRB,UNIRB,Centro Universitário,Privada com fins lucrativos,BA,22.0,1.0,2.739,0.0,0.0,0.0,0.0,2.739,3,
2021,2079.0,FACULDADE DE ITAITUBA,FAI,Faculdade,Privada com fins lucrativos,PA,5.0,1.0,2.015,0.0,0.0,0.0,0.0,2.015,3,
2021,2082.0,FACULDADE DE CIÊNCIAS MÉDICAS DA PARAÍBA,FCM-PB,Faculdade,Privada com fins lucrativos,PB,3.0,1.0,2.724,0.0,0.0,0.0,0.0,2.724,3,
2021,2084.0,FACULDADE CNEC NOVA PETRÓPOLIS,,Faculdade,Privada sem fins lucrativos,RS,2.0,1.0,3.081,0.0,0.0,0.0,0.0,3.081,4,
2021,2085.0,CENTRO UNIVERSITÁRIO DE SALVADOR,UNICEUSA,Centro Universitário,Privada com fins lucrativos,BA,5.0,1.0,2.392,0.0,0.0,0.0,0.0,2.392,3,
2021,2086.0,INSTITUTO DE ENSINO SUPERIOR DE FOZ DO IGUAÇU,IESFI,Faculdade,Privada com fins lucrativos,PR,5.0,1.0,2.026,0.0,0.0,0.0,0.0,2.026,3,
2021,2096.0,FACULDADE DOCTUM DE MANHUAÇU - DOCTUM,FCM,Faculdade,Privada sem fins lucrativos,MG,3.0,1.0,3.094,0.0,0.0,0.0,0.0,3.094,4,
2021,2098.0,FACULDADE EXCELÊNCIA,FAEX,Faculdade,Privada sem fins lucrativos,CE,4.0,1.0,1.886,0.0,0.0,0.0,0.0,1.886,2,
2021,2111.0,CENTRO UNIVERSITÁRIO INTA,UNINTA,Centro Universitário,Privada sem fins lucrativos,CE,23.0,0.998,2.598,0.001,4.0,0.0,0.0,2.6,3,
2021,2113.0,FACULDADE DOM BOSCO DE PORTO ALEGRE,FDB,Faculdade,Privada sem fins lucrativos,RS,7.0,1.0,2.957,0.0,0.0,0.0,0.0,2.957,4,
2021,2117.0,FACULDADE DE CIÊNCIA E TECNOLOGIA,FACITEC,Faculdade,Privada com fins lucrativos,PR,2.0,1.0,2.201,0.0,0.0,0.0,0.0,2.201,3,
2021,2122.0,CENTRO UNIVERSITÁRIO ESTÁCIO DE SERGIPE,,Centro Universitário,Privada com fins lucrativos,SE,13.0,1.0,2.601,0.0,0.0,0.0,0.0,2.601,3,
2021,2123.0,CENTRO UNIVERSITÁRIO MAX PLANCK,UniMAX,Centro Universitário,Privada com fins lucrativos,SP,17.0,1.0,2.792,0.0,0.0,0.0,0.0,2.792,3,
2021,2124.0,FACULDADE CALAFIORI,CALAFIORI,Faculdade,Privada com fins lucrativos,MG,3.0,1.0,2.184,0.0,0.0,0.0,0.0,2.184,3,
2021,2126.0,ESCOLA DE DIREITO DO RIO DE JANEIRO,DIREITO RIO,Faculdade,Privada sem fins lucrativos,RJ,1.0,0.607,3.868,0.297,4.5,0.095,4.5,4.116,5,
2021,2128.0,Escola de Direito de São Paulo - FGV DIREITO SP,FGV DIREITO SP,Faculdade,Privada sem fins lucrativos,SP,1.0,0.293,4.102,0.659,4.5,0.046,4.5,4.383,5,
2021,2129.0,ESCOLA DE ECONOMIA DE SÃO PAULO,EESP,Faculdade,Privada sem fins lucrativos,SP,1.0,0.087,3.004,0.65,4.933,0.261,5.0,4.781,5,
2021,2131.0,FACULDADE DE SÃO BERNARDO DO CAMPO,FAPAN,Faculdade,Privada com fins lucrativos,SP,1.0,1.0,2.405,0.0,0.0,0.0,0.0,2.405,3,
2021,2132.0,CENTRO UNIVERSITÁRIO UNINORTE,,Centro Universitário,Privada com fins lucrativos,AC,18.0,1.0,2.916,0.0,0.0,0.0,0.0,2.916,3,
2021,2133.0,"Faculdade de Ciências, Educação e Teologia do Norte do Brasil",FACETEN,Faculdade,Privada sem fins lucrativos,RR,3.0,1.0,2.47,0.0,0.0,0.0,0.0,2.47,3,
2021,2134.0,FACULDADE ASSEMBLEIANA DO BRASIL,,Faculdade,Privada sem fins lucrativos,GO,1.0,1.0,2.213,0.0,0.0,0.0,0.0,2.213,3,
2021,2135.0,CENTRO UNIVERSITÁRIO CATÓLICA DE QUIXADÁ,UNICATÓLICA,Centro Universitário,Privada sem fins lucrativos,CE,16.0,1.0,3.022,0.0,0.0,0.0,0.0,3.022,4,
2021,2140.0,FACULDADE NOSSA SENHORA DE LOURDES,FNSL,Faculdade,Privada com fins lucrativos,BA,1.0,1.0,1.79,0.0,0.0,0.0,0.0,1.79,2,
2021,2141.0,FACULDADES BATISTA DO PARANÁ,FABAPAR,Faculdade,Privada sem fins lucrativos,PR,2.0,0.842,2.628,0.157,4.0,0.0,0.0,2.844,3,
2021,2145.0,FACULDADE PROMOVE DE TECNOLOGIA,FPTEC,Faculdade,Privada com fins lucrativos,MG,4.0,1.0,3.584,0.0,0.0,0.0,0.0,3.584,4,
2021,2147.0,Centro Universitário CEUNI - FAMETRO,FAMETRO,Centro Universitário,Privada com fins lucrativos,AM,34.0,1.0,3.121,0.0,0.0,0.0,0.0,3.121,4,
2021,2148.0,FACULDADE DE PALMAS,FAPAL,Faculdade,Privada com fins lucrativos,TO,13.0,1.0,2.297,0.0,0.0,0.0,0.0,2.297,3,
2021,2149.0,FACULDADE MATO GROSSO DO SUL,FACSUL,Faculdade,Privada com fins lucrativos,MS,13.0,1.0,2.211,0.0,0.0,0.0,0.0,2.211,3,
2021,2150.0,CENTRO UNIVERSITÁRIO DO PIAUÍ,UNIFAPI,Centro Universitário,Privada com fins lucrativos,PI,10.0,1.0,2.062,0.0,0.0,0.0,0.0,2.062,3,
2021,2154.0,INSTITUTO SUPERIOR DE CIÊNCIAS HUMANAS E SOCIAIS ANÍSIO TEIXEIRA,ISAT,Faculdade,Privada com fins lucrativos,RJ,2.0,1.0,2.409,0.0,0.0,0.0,0.0,2.409,3,
2021,2158.0,FACULDADE SANTA MARIA,FSM,Faculdade,Privada com fins lucrativos,PB,10.0,1.0,2.676,0.0,0.0,0.0,0.0,2.676,3,
2021,2160.0,FACULDADE SANT ANA,IESSA,Faculdade,Privada sem fins lucrativos,PR,8.0,1.0,2.501,0.0,0.0,0.0,0.0,2.501,3,
2021,2165.0,FACULDADE FOZ DO IGUAÇU,FAFIG,Faculdade,Privada com fins lucrativos,PR,1.0,1.0,1.718,0.0,0.0,0.0,0.0,1.718,2,
2021,2171.0,INSTITUTO BELO HORIZONTE DE ENSINO SUPERIOR,IBHES,Faculdade,Privada com fins lucrativos,MG,3.0,1.0,2.171,0.0,0.0,0.0,0.0,2.171,3,
2021,2174.0,FACULDADE DE SANTA CATARINA,FASC,Faculdade,Privada com fins lucrativos,SC,2.0,1.0,2.215,0.0,0.0,0.0,0.0,2.215,3,
2021,2175.0,CENTRO UNIVERSITÁRIO DANTE,UNIDANTE,Centro Universitário,Privada com fins lucrativos,SC,15.0,1.0,2.923,0.0,0.0,0.0,0.0,2.923,3,
2021,2177.0,INSTITUTO PAULISTA DE ENSINO,FIPEN,Faculdade,Privada com fins lucrativos,SP,4.0,1.0,2.441,0.0,0.0,0.0,0.0,2.441,3,
2021,2180.0,RATIO - FACULDADE TEOLÓGICA E FILOSÓFICA,RATIO,Faculdade,Privada com fins lucrativos,CE,1.0,1.0,1.856,0.0,0.0,0.0,0.0,1.856,2,
2021,2183.0,CENTRO UNIVERSITÁRIO FUNDAÇÃO SANTO ANDRÉ,CUFSA,Centro Universitário,Privada sem fins lucrativos,SP,24.0,1.0,2.031,0.0,0.0,0.0,0.0,2.031,3,
2021,2184.0,FACULDADE CNEC GRAVATAÍ,,Faculdade,Privada sem fins lucrativos,RS,4.0,1.0,2.678,0.0,0.0,0.0,0.0,2.678,3,
2021,2186.0,FACULDADE SALESIANA DOM BOSCO,FSDB,Faculdade,Privada sem fins lucrativos,AM,9.0,1.0,2.19,0.0,0.0,0.0,0.0,2.19,3,
2021,2189.0,FACULDADE DO MARANHÃO,FACAM-MA,Faculdade,Privada com fins lucrativos,MA,11.0,1.0,2.436,0.0,0.0,0.0,0.0,2.436,3,
2021,2191.0,FACULDADE ANHANGUERA DE PELOTAS,,Faculdade,Privada com fins lucrativos,RS,10.0,1.0,2.516,0.0,0.0,0.0,0.0,2.516,3,
2021,2192.0,INSTITUTO SUPERIOR DE EDUCAÇÃO IVOTI,ISEI,Faculdade,Privada sem fins lucrativos,RS,2.0,1.0,3.256,0.0,0.0,0.0,0.0,3.256,4,
2021,2194.0,FACULDADE ANHANGUERA DO RIO GRANDE,,Faculdade,Privada com fins lucrativos,RS,9.0,1.0,2.269,0.0,0.0,0.0,0.0,2.269,3,
2021,2198.0,FACULDADE MONTEIRO LOBATO,FATO,Faculdade,Privada sem fins lucrativos,RS,6.0,1.0,2.171,0.0,0.0,0.0,0.0,2.171,3,
2021,2200.0,FACULDADE VALE DO GORUTUBA,FAVAG,Faculdade,Privada com fins lucrativos,MG,4.0,1.0,2.384,0.0,0.0,0.0,0.0,2.384,3,
2021,2202.0,INSTITUTO SUPERIOR DE EDUCAÇÃO DE GUARATUBA,ISEPE Guaratuba,Faculdade,Privada com fins lucrativos,PR,1.0,1.0,2.793,0.0,0.0,0.0,0.0,2.793,3,
2021,2205.0,Faculdade REGES de Tupi Paulista,,Faculdade,Privada sem fins lucrativos,SP,2.0,1.0,2.923,0.0,0.0,0.0,0.0,2.923,3,
2021,2220.0,Faculdade Doctum de Juiz de Fora,DOCTUM,Faculdade,Privada sem fins lucrativos,MG,6.0,1.0,3.01,0.0,0.0,0.0,0.0,3.01,4,
2021,2222.0,Centro Universitário do Rio São Francisco Unirios,UNIRIOS,Centro Universitário,Privada com fins lucrativos,BA,7.0,1.0,2.9,0.0,0.0,0.0,0.0,2.9,3,
2021,2229.0,FACULDADE UNIS SÃO LOURENÇO,,Faculdade,Privada com fins lucrativos,MG,5.0,1.0,2.255,0.0,0.0,0.0,0.0,2.255,3,
2021,2233.0,FACULDADE DE CIÊNCIAS SOCIAIS APLICADAS DE BELO HORIZONTE,FACISABH,Faculdade,Privada com fins lucrativos,MG,8.0,1.0,2.584,0.0,0.0,0.0,0.0,2.584,3,
2021,2237.0,FACULDADE TEOLÓGICA BATISTA EQUATORIAL,FATEBE,Faculdade,Privada sem fins lucrativos,PA,1.0,1.0,2.31,0.0,0.0,0.0,0.0,2.31,3,
2021,2240.0,FACULDADE DE FORTALEZA,FAFOR,Faculdade,Privada com fins lucrativos,CE,3.0,1.0,2.283,0.0,0.0,0.0,0.0,2.283,3,
2021,2241.0,CENTRO UNIVERSITÁRIO DO SUDESTE MINEIRO,UNICSUM,Centro Universitário,Privada com fins lucrativos,MG,11.0,1.0,2.247,0.0,0.0,0.0,0.0,2.247,3,
2021,2242.0,FACULDADE DO RECIFE,FAREC,Faculdade,Privada com fins lucrativos,PE,7.0,1.0,2.355,0.0,0.0,0.0,0.0,2.355,3,
2021,2244.0,FACULDADE DA CIDADE DE MACEIÓ,FACIMA,Faculdade,Privada com fins lucrativos,AL,9.0,1.0,2.038,0.0,0.0,0.0,0.0,2.038,3,
2021,2246.0,FACULDADE METROPOLITANA DE CIENCIAS E TECNOLOGIA,FAMEC,Faculdade,Privada com fins lucrativos,RN,2.0,1.0,2.413,0.0,0.0,0.0,0.0,2.413,3,
2021,2248.0,FACULDADE SERGIPANA,FASER,Faculdade,Privada com fins lucrativos,SE,1.0,1.0,1.412,0.0,0.0,0.0,0.0,1.412,2,
2021,2257.0,FACULDADE DIADEMA,FAD,Faculdade,Privada sem fins lucrativos,SP,3.0,1.0,1.943,0.0,0.0,0.0,0.0,1.943,2,
2021,2264.0,FACULDADE DE COMUNICAÇÃO PITÁGORAS UNIDADE GUARAPARI,PIT GUARAPARI,Faculdade,Privada com fins lucrativos,ES,1.0,1.0,3.638,0.0,0.0,0.0,0.0,3.638,4,
2021,2266.0,FACULDADE UNIÃO DE GOYAZES FORMOSA,FUG,Faculdade,Privada com fins lucrativos,GO,3.0,1.0,2.557,0.0,0.0,0.0,0.0,2.557,3,
2021,2270.0,FACULDADE DE CIÊNCIAS SOCIAIS APLICADAS DE EXTREMA,FAEX,Faculdade,Privada sem fins lucrativos,MG,8.0,1.0,2.494,0.0,0.0,0.0,0.0,2.494,3,
2021,2271.0,FACULDADE PITÁGORAS DE IPATINGA,FPI,Faculdade,Privada com fins lucrativos,MG,17.0,1.0,2.638,0.0,0.0,0.0,0.0,2.638,3,
2021,2275.0,FACULDADE SANTO AGOSTINHO,FASA,Faculdade,Privada com fins lucrativos,MG,10.0,1.0,2.291,0.0,0.0,0.0,0.0,2.291,3,
2021,2279.0,Centro Universitário Metrocamp Wyden,UniMetrocamp Wyden,Centro Universitário,Privada com fins lucrativos,SP,26.0,1.0,2.509,0.0,0.0,0.0,0.0,2.509,3,
2021,2282.0,FACULDADE DE CAFELÂNDIA,FAC,Faculdade,Privada com fins lucrativos,PR,1.0,1.0,2.64,0.0,0.0,0.0,0.0,2.64,3,
2021,2287.0,ESCOLA SUPERIOR DE TEOLOGIA E ESPIRITUALIDADE FRANCISCANA,ESTEF,Faculdade,Privada sem fins lucrativos,RS,1.0,1.0,2.402,0.0,0.0,0.0,0.0,2.402,3,
2021,2288.0,FACULDADE ALMEIDA RODRIGUES,FAR,Faculdade,Privada com fins lucrativos,GO,1.0,1.0,2.583,0.0,0.0,0.0,0.0,2.583,3,
2021,2289.0,FACULDADE UNIÃO CULTURAL DO ESTADO DE SÃO PAULO,UCESP,Faculdade,Privada sem fins lucrativos,SP,1.0,1.0,2.077,0.0,0.0,0.0,0.0,2.077,3,
2021,2297.0,FACULDADE DE DIREITO DE SANTA MARIA,FADISMA,Faculdade,Privada com fins lucrativos,RS,2.0,1.0,2.147,0.0,0.0,0.0,0.0,2.147,3,
2021,2301.0,FACULDADE FIDELIS,FF,Faculdade,Privada sem fins lucrativos,PR,2.0,1.0,2.394,0.0,0.0,0.0,0.0,2.394,3,
2021,2311.0,FACULDADE KENNEDY DE MINAS GERAIS - FKMG,FKMG,Faculdade,Privada com fins lucrativos,MG,1.0,1.0,3.042,0.0,0.0,0.0,0.0,3.042,4,
2021,2312.0,FACULDADE LUTERANA RUI BARBOSA,FALURB,Faculdade,Privada sem fins lucrativos,PR,2.0,1.0,2.422,0.0,0.0,0.0,0.0,2.422,3,
2021,2320.0,INSTITUTO SUPERIOR DE EDUCAÇÃO ATENEU,ISEAT,Faculdade,Privada com fins lucrativos,ES,2.0,1.0,1.648,0.0,0.0,0.0,0.0,1.648,2,
2021,2323.0,FACULDADE DA AMAZÔNIA,FAMA,Faculdade,Privada com fins lucrativos,RO,2.0,1.0,1.344,0.0,0.0,0.0,0.0,1.344,2,
2021,2324.0,FACULDADE ANHANGUERA DE SÃO JOSÉ - SC,FASJ - SC,Faculdade,Privada com fins lucrativos,SC,7.0,1.0,1.88,0.0,0.0,0.0,0.0,1.88,2,
2021,2328.0,FACULDADE ITEANA DE BOTUCATU,FITB,Faculdade,Privada sem fins lucrativos,SP,3.0,1.0,2.496,0.0,0.0,0.0,0.0,2.496,3,
2021,2330.0,Faculdade Cândido Rondon,FCR,Faculdade,Privada sem fins lucrativos,MT,1.0,1.0,2.118,0.0,0.0,0.0,0.0,2.118,3,
2021,2332.0,FACULDADE CORPORATIVA CESPI,FACESPI,Faculdade,Privada com fins lucrativos,SP,1.0,1.0,2.126,0.0,0.0,0.0,0.0,2.126,3,
2021,2334.0,FACULDADE CNEC RIO DAS OSTRAS,,Faculdade,Privada sem fins lucrativos,RJ,7.0,1.0,2.313,0.0,0.0,0.0,0.0,2.313,3,
2021,2336.0,CENTRO UNIVERSITÁRIO BRASÍLIA DO ESTADO DE GOIÁS,UNIBRAS,Centro Universitário,Privada com fins lucrativos,GO,13.0,1.0,2.695,0.0,0.0,0.0,0.0,2.695,3,
2021,2341.0,FACULDADE DA ALDEIA DE CARAPICUÍBA,FALC,Faculdade,Privada com fins lucrativos,SP,3.0,1.0,1.564,0.0,0.0,0.0,0.0,1.564,2,
2021,2343.0,Centro Universitário U:VERSE,,Centro Universitário,Privada com fins lucrativos,AC,8.0,1.0,3.138,0.0,0.0,0.0,0.0,3.138,4,
2021,2350.0,ESCOLA SUPERIOR MADRE CELESTE,ESMAC,Faculdade,Privada com fins lucrativos,PA,6.0,1.0,2.436,0.0,0.0,0.0,0.0,2.436,3,
2021,2351.0,FACULDADE ESPÍRITO SANTENSE DE CIÊNCIAS JURÍDICAS,PIO XII - DIR,Faculdade,Privada sem fins lucrativos,ES,1.0,1.0,2.662,0.0,0.0,0.0,0.0,2.662,3,
2021,2355.0,FACULDADE ANHANGUERA DE MATÃO,,Faculdade,Privada com fins lucrativos,SP,4.0,1.0,1.744,0.0,0.0,0.0,0.0,1.744,2,
2021,2365.0,CENTRO UNIVERSITÁRIO CATÓLICA DO TOCANTINS,UNICATÓLICA,Centro Universitário,Privada sem fins lucrativos,TO,11.0,1.0,2.949,0.0,0.0,0.0,0.0,2.949,4,
2021,2368.0,FACULDADE SÃO LEOPOLDO MANDIC,,Faculdade,Privada com fins lucrativos,SP,2.0,0.328,3.309,0.545,4.5,0.125,4.5,4.108,5,
2021,2369.0,INSTITUTO DE ENSINO SUPERIOR SANTO ANTÔNIO,INESA,Faculdade,Privada com fins lucrativos,SC,2.0,1.0,2.595,0.0,0.0,0.0,0.0,2.595,3,
2021,2380.0,Faculdade Estácio do Amapá - Estácio Amapá,ESTÁCIO AMAPÁ,Faculdade,Privada com fins lucrativos,AP,6.0,1.0,2.499,0.0,0.0,0.0,0.0,2.499,3,
2021,2383.0,FACULDADE MERIDIONAL,IMED,Faculdade,Privada com fins lucrativos,RS,7.0,0.874,3.079,0.125,4.116,0.0,0.0,3.209,4,
2021,2389.0,FACULDADE DE FILOSOFIA E TEOLOGIA PAULO VI,FFTP,Faculdade,Privada sem fins lucrativos,SP,1.0,1.0,2.548,0.0,0.0,0.0,0.0,2.548,3,
2021,2397.0,FACULDADE FUCAPE,FUCAPE,Faculdade,Privada sem fins lucrativos,ES,3.0,0.363,3.916,0.39,4.613,0.246,5.0,4.455,5,
2021,2399.0,FACULDADE DE SOROCABA,,Faculdade,Privada com fins lucrativos,SP,1.0,1.0,2.149,0.0,0.0,0.0,0.0,2.149,3,
2021,2402.0,Faculdade de Tecnologia e Ciências,FTC CENTRO,Faculdade,Privada com fins lucrativos,BA,6.0,1.0,2.779,0.0,0.0,0.0,0.0,2.779,3,
2021,2408.0,FACULDADE ESAMC SANTOS,ESAMC,Faculdade,Privada com fins lucrativos,SP,19.0,1.0,2.054,0.0,0.0,0.0,0.0,2.054,3,
2021,2409.0,CENTRO UNIVERSITÁRIO TABOSA DE ALMEIDA,ASCES-UNITA,Centro Universitário,Privada sem fins lucrativos,PE,18.0,1.0,2.759,0.0,0.0,0.0,0.0,2.759,3,
2021,2410.0,FACULDADE CEARENSE,FAC,Faculdade,Privada sem fins lucrativos,CE,10.0,1.0,2.159,0.0,0.0,0.0,0.0,2.159,3,
2021,2413.0,FACULDADE DE ENSINO SUPERIOR DE FLORIANO,FAESF,Faculdade,Privada com fins lucrativos,PI,9.0,1.0,2.44,0.0,0.0,0.0,0.0,2.44,3,
2021,2420.0,FACULDADE PARANAENSE,FAPAR,Faculdade,Privada com fins lucrativos,PR,8.0,1.0,2.35,0.0,0.0,0.0,0.0,2.35,3,
2021,2423.0,FACULDADE DE CIÊNCIA E TECNOLOGIA DE MONTES CLAROS,FACIT,Faculdade,Privada sem fins lucrativos,MG,7.0,1.0,2.227,0.0,0.0,0.0,0.0,2.227,3,
2021,2426.0,Centro Universitário Fibra,UNIFIBRA,Centro Universitário,Privada com fins lucrativos,PA,7.0,1.0,2.897,0.0,0.0,0.0,0.0,2.897,3,
2021,2427.0,FACULDADE LUSÓFONA DA BAHIA,FL - BA,Faculdade,Privada com fins lucrativos,BA,1.0,1.0,2.341,0.0,0.0,0.0,0.0,2.341,3,
2021,2428.0,FACULDADE DE CIÊNCIAS E TECNOLOGIAS DE CAMPOS GERAIS,FACICA,Faculdade,Privada com fins lucrativos,MG,4.0,1.0,2.661,0.0,0.0,0.0,0.0,2.661,3,
2021,2437.0,FACULDADE PITÁGORAS DE TEIXEIRA DE FREITAS,PIT TEIXEIRA,Faculdade,Privada com fins lucrativos,BA,15.0,1.0,2.268,0.0,0.0,0.0,0.0,2.268,3,
2021,2440.0,FACULDADE CIDADE DE JOÃO PINHEIRO,FCJP,Faculdade,Privada sem fins lucrativos,MG,4.0,1.0,2.16,0.0,0.0,0.0,0.0,2.16,3,
2021,2442.0,FACULDADE DE CIÊNCIAS BIOMÉDICAS DO ESPÍRITO SANTO,PIO XII - BIO,Faculdade,Privada sem fins lucrativos,ES,1.0,1.0,2.281,0.0,0.0,0.0,0.0,2.281,3,
2021,2443.0,FACULDADE FUNORTE DE JANAÚBA,,Faculdade,Privada com fins lucrativos,MG,3.0,1.0,3.277,0.0,0.0,0.0,0.0,3.277,4,
2021,2444.0,Faculdade Unirb - Barreiras,,Faculdade,Privada sem fins lucrativos,BA,1.0,1.0,2.03,0.0,0.0,0.0,0.0,2.03,3,
2021,2450.0,FACULDADE PROMOVE DE BELO HORIZONTE,PROMOVE,Faculdade,Privada com fins lucrativos,MG,3.0,1.0,2.879,0.0,0.0,0.0,0.0,2.879,3,
2021,2456.0,FACULDADE DE ADMINISTRAÇÃO DE CHAPADÃO DO SUL,FACHASUL,Faculdade,Privada sem fins lucrativos,MS,1.0,1.0,1.313,0.0,0.0,0.0,0.0,1.313,2,
2021,2459.0,FACULDADE DE ESTUDOS AVANÇADOS DO PARÁ,FEAPA,Faculdade,Privada com fins lucrativos,PA,4.0,1.0,2.777,0.0,0.0,0.0,0.0,2.777,3,
2021,2460.0,FACULDADE ESTÁCIO DE NATAL,ESTÁCIO DE NATAL,Faculdade,Privada com fins lucrativos,RN,5.0,1.0,2.444,0.0,0.0,0.0,0.0,2.444,3,
2021,2462.0,FACULDADE SÃO LUÍS,FSL,Faculdade,Privada sem fins lucrativos,SC,2.0,1.0,3.327,0.0,0.0,0.0,0.0,3.327,4,
2021,2465.0,FACULDADE IBMEC SÃO PAULO,IBMEC SP,Faculdade,Privada com fins lucrativos,SP,1.0,1.0,3.065,0.0,0.0,0.0,0.0,3.065,4,
2021,2466.0,FACUDADE IEDUCARE - FIED,FIED,Faculdade,Privada sem fins lucrativos,CE,4.0,1.0,2.66,0.0,0.0,0.0,0.0,2.66,3,
2021,2468.0,INSTITUTO TEOLÓGICO FRANCISCANO,ITF,Faculdade,Privada sem fins lucrativos,RJ,1.0,1.0,3.385,0.0,0.0,0.0,0.0,3.385,4,
2021,2469.0,INSTITUTO MACAPAENSE DE ENSINO SUPERIOR,IMMES,Faculdade,Privada com fins lucrativos,AP,8.0,1.0,1.501,0.0,0.0,0.0,0.0,1.501,2,
2021,2470.0,INSTITUTO SALVADOR DE ENSINO E CULTURA,ISEC,Faculdade,Privada com fins lucrativos,BA,3.0,1.0,2.654,0.0,0.0,0.0,0.0,2.654,3,
