2021,750.0,UNIVERSIDADE DE GURUPI,UnirG,Universidade,Pública Municipal,TO,14.0,1.0,1.803,0.0,0.0,0.0,0.0,1.803,2,
2021,752.0,FACULDADE DE PARÁ DE MINAS,FAPAM,Faculdade,Privada sem fins lucrativos,MG,8.0,1.0,3.064,0.0,0.0,0.0,0.0,3.064,4,
2021,753.0,FACULDADE DE CIÊNCIAS HUMANAS DO SERTÃO CENTRAL,FACHUSC,Faculdade,Pública Municipal,PE,6.0,1.0,1.826,0.0,0.0,0.0,0.0,1.826,2,
2021,755.0,CENTRO DE ENSINO SUPERIOR DE JATAÍ,CESUT,Faculdade,Privada com fins lucrativos,GO,1.0,1.0,2.003,0.0,0.0,0.0,0.0,2.003,3,
2021,756.0,UNIVERSIDADE ESTADUAL DO PIAUÍ,UESPI,Universidade,Pública Estadual,PI,88.0,0.953,2.615,0.045,4.47,0.0,4.5,2.701,3,
2021,757.0,Centro Universitário da Amazônia,Unama,Centro Universitário,Privada com fins lucrativos,PA,11.0,1.0,2.751,0.0,0.0,0.0,0.0,2.751,3,
2021,760.0,FACULDADE DE CIÊNCIAS HUMANAS DE PERNAMBUCO,FCHPE,Faculdade,Privada com fins lucrativos,PE,3.0,1.0,2.071,0.0,0.0,0.0,0.0,2.071,3,
2021,763.0,CENTRO UNIVERSITÁRIO DE GOIÂNIA,UNICEUG,Centro Universitário,Privada com fins lucrativos,GO,11.0,1.0,2.244,0.0,0.0,0.0,0.0,2.244,3,
2021,764.0,FACULDADE PINHEIRO GUIMARÃES,FAPG,Faculdade,Privada sem fins lucrativos,RJ,1.0,1.0,1.791,0.0,0.0,0.0,0.0,1.791,2,
2021,778.0,FACULDADE DE TECNOLOGIA DE JACAREÍ,ETEP,Faculdade,Privada com fins lucrativos,SP,1.0,1.0,2.393,0.0,0.0,0.0,0.0,2.393,3,
2021,779.0,FACULDADE DE PONTA PORÃ,FAP,Faculdade,Privada com fins lucrativos,MS,1.0,1.0,1.981,0.0,0.0,0.0,0.0,1.981,3,
2021,780.0,UNIVERSIDADE DE CUIABÁ,UNIC/UNIME,Universidade,Privada com fins lucrativos,MT,29.0,0.98,2.456,0.011,4.156,0.007,4.5,2.491,3,
2021,781.0,FACULDADE DE RONDONÓPOLIS,FAR,Faculdade,Privada com fins lucrativos,MT,20.0,1.0,1.994,0.0,0.0,0.0,0.0,1.994,3,
2021,785.0,FACULDADE DE EDUCAÇÃO DE TANGARÁ DA SERRA,,Faculdade,Privada com fins lucrativos,MT,1.0,1.0,2.307,0.0,0.0,0.0,0.0,2.307,3,
2021,788.0,FACULDADE DE RONDÔNIA,FARO,Faculdade,Privada sem fins lucrativos,RO,5.0,1.0,2.654,0.0,0.0,0.0,0.0,2.654,3,
2021,789.0,UNIVERSIDADE FEDERAL DE RORAIMA,UFRR,Universidade,Pública Federal,RR,32.0,0.876,2.919,0.097,4.195,0.026,4.5,3.085,4,
2021,790.0,Faculdade Israelita de Ciências da Saúde Albert Einstein,FICSAE,Faculdade,Privada sem fins lucrativos,SP,1.0,0.588,3.382,0.234,4.222,0.176,4.5,3.777,4,
2021,792.0,CENTRO UNIVERSITÁRIO DO ESTADO DO PARÁ,CESUPA,Centro Universitário,Privada sem fins lucrativos,PA,12.0,0.969,3.324,0.03,4.0,0.0,0.0,3.344,4,
2021,793.0,Centro Universitário Estácio de São Paulo,ESTÁCIO SÃO PAULO,Centro Universitário,Privada com fins lucrativos,SP,36.0,1.0,2.531,0.0,0.0,0.0,0.0,2.531,3,
2021,794.0,CENTRO UNIVERSITÁRIO DE VÁRZEA GRANDE,UNIVAG,Centro Universitário,Privada sem fins lucrativos,MT,34.0,1.0,3.363,0.0,0.0,0.0,0.0,3.363,4,
2021,795.0,FACULDADES INTEGRADAS DE DIAMANTINO,FID,Faculdade,Privada sem fins lucrativos,MT,2.0,1.0,1.908,0.0,0.0,0.0,0.0,1.908,2,
2021,796.0,FACULDADE DE CIÊNCIAS SOCIAIS APLICADAS DO VALE DO SÃO LOURENÇO,EDUVALE,Faculdade,Privada com fins lucrativos,MT,4.0,1.0,3.022,0.0,0.0,0.0,0.0,3.022,4,
2021,797.0,Faculdade AVEC de Vilhena,AVEC,Faculdade,Privada com fins lucrativos,RO,3.0,1.0,2.053,0.0,0.0,0.0,0.0,2.053,3,
2021,798.0,FACULDADES INTEGRADAS DE ARACRUZ,FAACZ,Faculdade,Privada sem fins lucrativos,ES,9.0,1.0,2.696,0.0,0.0,0.0,0.0,2.696,3,
2021,802.0,CENTRO UNIVERSITÁRIO UNICARIOCA,UNICARIOCA,Centro Universitário,Privada sem fins lucrativos,RJ,32.0,0.984,3.545,0.015,4.0,0.0,0.0,3.552,4,
2021,803.0,FACULDADE INTERAÇÃO AMERICANA,FIA,Faculdade,Privada sem fins lucrativos,SP,2.0,1.0,2.103,0.0,0.0,0.0,0.0,2.103,3,
2021,809.0,FACULDADE DE DIREITO E CIÊNCIAS SOCIAIS DO LESTE DE MINAS - FADILESTE,FADILESTE,Faculdade,Privada sem fins lucrativos,MG,1.0,1.0,1.868,0.0,0.0,0.0,0.0,1.868,2,
2021,810.0,CENTRO TÉCNICO-EDUCACIONAL SUPERIOR DO OESTE PARANAENSE,CTESOP,Faculdade,Privada com fins lucrativos,PR,4.0,1.0,2.45,0.0,0.0,0.0,0.0,2.45,3,
2021,823.0,UNIVERSIDADE CEUMA,UNICEUMA,Universidade,Privada sem fins lucrativos,MA,47.0,0.981,2.855,0.012,4.12,0.006,4.5,2.881,3,
2021,824.0,CENTRO UNIVERSITÁRIO DE GOIATUBA,UNICERRADO,Centro Universitário,Pública Municipal,GO,11.0,1.0,2.574,0.0,0.0,0.0,0.0,2.574,3,
2021,825.0,FACULDADE PRESBITERIANA GAMMON,FAGAMMON,Faculdade,Privada sem fins lucrativos,MG,4.0,1.0,2.615,0.0,0.0,0.0,0.0,2.615,3,
2021,826.0,CENTRO UNIVERSITÁRIO DE DESENVOLVIMENTO DO CENTRO OESTE,UNIDESC,Centro Universitário,Privada com fins lucrativos,GO,9.0,1.0,2.573,0.0,0.0,0.0,0.0,2.573,3,
2021,828.0,FACULDADE DE SÃO LOURENÇO,FASAMA,Faculdade,Privada com fins lucrativos,MG,11.0,1.0,2.586,0.0,0.0,0.0,0.0,2.586,3,
2021,829.0,UNIVERSIDADE ESTADUAL DO TOCANTINS,UNITINS,Universidade,Pública Estadual,TO,13.0,1.0,2.449,0.0,0.0,0.0,0.0,2.449,3,
2021,830.0,UNIVERSIDADE FEDERAL DO AMAPÁ,UNIFAP,Universidade,Pública Federal,AP,40.0,0.916,2.582,0.066,4.155,0.016,4.5,2.719,3,
2021,831.0,FACULDADE DE CIÊNCIAS HUMANAS DO VALE DO RIO GRANDE,FCHVRG,Faculdade,Privada com fins lucrativos,SP,1.0,1.0,1.896,0.0,0.0,0.0,0.0,1.896,2,
2021,832.0,FACULDADE ARQUIDIOCESANA DE CURVELO,FAC,Faculdade,Privada sem fins lucrativos,MG,3.0,1.0,1.893,0.0,0.0,0.0,0.0,1.893,2,
2021,843.0,FACULDADE DE CIÊNCIAS E TECNOLOGIA DE BIRIGUI,FATEB,Faculdade,Pública Municipal,SP,3.0,1.0,1.728,0.0,0.0,0.0,0.0,1.728,2,
2021,845.0,FACULDADE DA FUNDAÇÃO EDUCACIONAL ARAÇATUBA,FAC-FEA,Centro Universitário,Pública Municipal,SP,3.0,1.0,2.9,0.0,0.0,0.0,0.0,2.9,3,
2021,846.0,FACULDADE DE ADMINISTRAÇÃO DE TERESINA,FAT,Faculdade,Privada sem fins lucrativos,PI,1.0,1.0,1.969,0.0,0.0,0.0,0.0,1.969,3,
2021,847.0,FACULDADE PIAUIENSE DE PROCESSAMENTO DE DADOS,FPPD,Faculdade,Privada sem fins lucrativos,PI,1.0,1.0,1.837,0.0,0.0,0.0,0.0,1.837,2,
2021,849.0,FACULDADE JESUÍTA DE FILOSOFIA E TEOLOGIA,FAJE,Faculdade,Privada sem fins lucrativos,MG,3.0,0.42,3.919,0.336,4.661,0.242,5.0,4.431,5,
2021,852.0,FIAP - Centro Universitário,,Centro Universitário,Privada com fins lucrativos,SP,14.0,1.0,3.412,0.0,0.0,0.0,0.0,3.412,4,
2021,861.0,CENTRO DE ENSINO SUPERIOR DO AMAPÁ,CEAP,Faculdade,Privada com fins lucrativos,AP,7.0,1.0,2.255,0.0,0.0,0.0,0.0,2.255,3,
2021,862.0,FACULDADE ESTÁCIO DE SÁ DE CAMPO GRANDE,FESCG,Faculdade,Privada com fins lucrativos,MS,11.0,1.0,2.369,0.0,0.0,0.0,0.0,2.369,3,
2021,873.0,FACULDADES UNIFICADAS DE FOZ DO IGUAÇU,UNIFOZ,Faculdade,Privada com fins lucrativos,PR,2.0,1.0,1.927,0.0,0.0,0.0,0.0,1.927,2,
2021,877.0,FACULDADE DE ECONOMIA E PROCESSAMENTO DE DADOS DE FOZ DO IGUAÇU,FEPI,Faculdade,Privada com fins lucrativos,PR,1.0,1.0,1.529,0.0,0.0,0.0,0.0,1.529,2,
2021,878.0,Centro Universitário Católica do Leste de Minas Gerais,UNILESTE,Centro Universitário,Privada sem fins lucrativos,MG,21.0,1.0,3.257,0.0,0.0,0.0,0.0,3.257,4,
2021,882.0,INSTITUTO MUNICIPAL DE ENSINO SUPERIOR DE BEBEDOURO VICTÓRIO CARDASSI,IMESB,Faculdade,Pública Municipal,SP,8.0,1.0,2.619,0.0,0.0,0.0,0.0,2.619,3,
2021,886.0,FACULDADE DE HORTOLÂNDIA,FACH,Faculdade,Privada com fins lucrativos,SP,2.0,1.0,1.966,0.0,0.0,0.0,0.0,1.966,3,
2021,890.0,ESCOLA DE GOVERNO PROFESSOR PAULO NEVES DE CARVALHO,EG,Faculdade,Pública Estadual,MG,1.0,1.0,3.672,0.0,0.0,0.0,0.0,3.672,4,
2021,898.0,Centro Universitário Unisan,UNISAN,Centro Universitário,Privada sem fins lucrativos,SP,9.0,1.0,2.746,0.0,0.0,0.0,0.0,2.746,3,
2021,905.0,FACULDADE ESCOLA PAULISTA DE DIREITO,FACEPD,Faculdade,Privada com fins lucrativos,SP,1.0,0.469,3.918,0.53,4.0,0.0,0.0,3.961,5,
2021,908.0,FACULDADE ALAGOANA DE ADMINISTRAÇÃO,FAA,Faculdade,Privada com fins lucrativos,AL,1.0,1.0,1.998,0.0,0.0,0.0,0.0,1.998,3,
2021,909.0,Faculdade Fernanda Bicchieri,,Faculdade,Privada sem fins lucrativos,RJ,1.0,1.0,2.572,0.0,0.0,0.0,0.0,2.572,3,
2021,910.0,FACULDADE SANTA LÚCIA,FCACSL,Faculdade,Privada sem fins lucrativos,SP,4.0,1.0,2.765,0.0,0.0,0.0,0.0,2.765,3,
2021,913.0,FACULDADES INTEGRADAS DE PARANAÍBA - FIPAR,FIPAR,Faculdade,Privada sem fins lucrativos,MS,2.0,1.0,2.39,0.0,0.0,0.0,0.0,2.39,3,
2021,915.0,FACULDADE DE ADMINISTRAÇÃO DE FÁTIMA DO SUL,FAFS,Faculdade,Privada sem fins lucrativos,MS,3.0,1.0,1.784,0.0,0.0,0.0,0.0,1.784,2,
2021,916.0,FACULDADE ESTÁCIO DE TERESINA,ESTÁCIO TERESINA,Faculdade,Privada com fins lucrativos,PI,12.0,1.0,2.372,0.0,0.0,0.0,0.0,2.372,3,
2021,918.0,CENTRO UNIVERSITÁRIO UNIVEL,,Centro Universitário,Privada com fins lucrativos,PR,21.0,1.0,3.205,0.0,0.0,0.0,0.0,3.205,4,
2021,922.0,FACULDADE REGES DE DRACENA,FCGD,Faculdade,Privada sem fins lucrativos,SP,3.0,1.0,3.028,0.0,0.0,0.0,0.0,3.028,4,
2021,923.0,CENTRO UNIVERSITÁRIO SÃO ROQUE,UNISÃO ROQUE,Centro Universitário,Privada sem fins lucrativos,SP,8.0,1.0,3.085,0.0,0.0,0.0,0.0,3.085,4,
2021,926.0,Centro Universitário Anhanguera Pitágoras Unopar de Campo Grande,,Centro Universitário,Privada com fins lucrativos,MS,14.0,1.0,2.236,0.0,0.0,0.0,0.0,2.236,3,
2021,939.0,FACULDADE CATÓLICA DE ANÁPOLIS,CATÓLICA DE ANÁPOLIS,Faculdade,Privada sem fins lucrativos,GO,5.0,1.0,1.998,0.0,0.0,0.0,0.0,1.998,3,
2021,940.0,Faculdades Magsul,FAMAG,Faculdade,Privada sem fins lucrativos,MS,4.0,1.0,2.121,0.0,0.0,0.0,0.0,2.121,3,
2021,944.0,ESCOLA SUPERIOR DE PROPAGANDA E MARKETING DO RIO DE JANEIRO,ESPM,Faculdade,Privada sem fins lucrativos,RJ,4.0,0.967,3.143,0.032,4.0,0.0,0.0,3.171,4,
2021,945.0,Faculdade Funorte de Januária,,Faculdade,Privada com fins lucrativos,MG,2.0,1.0,2.96,0.0,0.0,0.0,0.0,2.96,4,
2021,952.0,UNIVERSIDADE SANTA CECÍLIA,UNISANTA,Universidade,Privada sem fins lucrativos,SP,30.0,0.975,2.944,0.023,4.102,0.0,4.5,2.973,4,
2021,953.0,UNIVERSIDADE METROPOLITANA DE SANTOS,UNIMES,Universidade,Privada sem fins lucrativos,SP,37.0,0.992,2.46,0.007,4.0,0.0,0.0,2.472,3,
2021,967.0,FACULDADE DE TECNOLOGIA DE TAQUARITINGA,FATEC/TQ,Faculdade,Pública Estadual,SP,2.0,1.0,2.499,0.0,0.0,0.0,0.0,2.499,3,
2021,976.0,FACULDADES INTEGRADAS DE PONTA PORÃ,FIP,Faculdade,Privada sem fins lucrativos,MS,2.0,1.0,2.82,0.0,0.0,0.0,0.0,2.82,3,
2021,985.0,FACULDADE EVANGÉLICA DE RUBIATABA,FER,Faculdade,Privada com fins lucrativos,GO,2.0,1.0,2.405,0.0,0.0,0.0,0.0,2.405,3,
2021,989.0,ESCOLA SUPERIOR EM MEIO AMBIENTE,ESMA,Faculdade,Privada sem fins lucrativos,MG,2.0,1.0,2.017,0.0,0.0,0.0,0.0,2.017,3,
2021,994.0,Faculdade de Duque de Caxias,FDC,Faculdade,Privada sem fins lucrativos,RJ,3.0,1.0,2.054,0.0,0.0,0.0,0.0,2.054,3,
2021,997.0,Centro Universitário de Bauru,,Centro Universitário,Privada sem fins lucrativos,SP,8.0,0.878,2.866,0.056,4.5,0.064,4.5,3.064,4,
2021,1012.0,FACULDADE DO SERTÃO DO PAJEÚ,FASP,Faculdade,Pública Municipal,PE,4.0,1.0,2.061,0.0,0.0,0.0,0.0,2.061,3,
2021,1014.0,INSTITUTO SUPERIOR E CENTRO EDUCACIONAL LUTERANO - BOM JESUS - IELUSC,BOM JESUS/IELUSC,Faculdade,Privada sem fins lucrativos,SC,7.0,1.0,2.608,0.0,0.0,0.0,0.0,2.608,3,
2021,1019.0,FACULDADE DE CIÊNCIAS E TECNOLOGIA DE UNAÍ - FACTU,FACTU,Faculdade,Privada sem fins lucrativos,MG,7.0,1.0,2.119,0.0,0.0,0.0,0.0,2.119,3,
2021,1021.0,FACULDADE DE CIÊNCIAS DE TIMBAÚBA,FACET,Faculdade,Privada sem fins lucrativos,PE,2.0,1.0,2.148,0.0,0.0,0.0,0.0,2.148,3,
2021,1027.0,UNIVERSIDADE ESTADUAL DO NORTE FLUMINENSE DARCY RIBEIRO,UENF,Universidade,Pública Estadual,RJ,17.0,0.581,3.357,0.181,4.7,0.236,4.76,3.933,4,
2021,1028.0,UNIVERSIDADE ESTADUAL DE MATO GROSSO DO SUL,UEMS,Universidade,Pública Estadual,MS,50.0,0.85,2.533,0.125,4.178,0.024,4.5,2.788,3,
2021,1030.0,Centro Universitário IBMEC,IBMEC,Centro Universitário,Privada com fins lucrativos,RJ,13.0,0.944,2.93,0.055,4.5,0.0,0.0,3.018,4,
2021,1032.0,CENTRO UNIVERSITÁRIO SALESIANO DE SÃO PAULO,UNISAL,Centro Universitário,Privada sem fins lucrativos,SP,51.0,0.986,2.491,0.013,4.281,0.0,0.0,2.515,3,
2021,1036.0,UNIVERSIDADE DO ESTADO DE MINAS GERAIS,UEMG,Universidade,Pública Estadual,MG,105.0,0.97,2.33,0.021,4.369,0.008,5.0,2.396,3,
2021,1038.0,FACULDADES INTEGRADAS DE TRÊS LAGOAS,AEMS,Faculdade,Privada sem fins lucrativos,MS,24.0,1.0,2.838,0.0,0.0,0.0,0.0,2.838,3,
2021,1041.0,UNIVERSIDADE DO VALE DO TAQUARI,UNIVATES,Universidade,Privada sem fins lucrativos,RS,47.0,0.889,3.476,0.054,4.636,0.056,4.745,3.61,4,
2021,1042.0,UNIVERSIDADE POSITIVO,UP,Universidade,Privada com fins lucrativos,PR,69.0,0.968,3.091,0.015,4.892,0.016,4.717,3.145,4,
2021,1043.0,CENTRO UNIVERSITÁRIO DA FUNDAÇÃO HERMINIO OMETTO,FHO,Centro Universitário,Privada sem fins lucrativos,SP,23.0,0.971,2.875,0.028,4.415,0.0,0.0,2.919,3,
2021,1045.0,CENTRO UNIVERSITÁRIO ANHANGÜERA,UNIFIAN,Centro Universitário,Privada com fins lucrativos,SP,16.0,1.0,2.291,0.0,0.0,0.0,0.0,2.291,3,
2021,1046.0,UNIÃO DAS FACULDADES DOS GRANDES LAGOS,UNILAGO,Faculdade,Privada sem fins lucrativos,SP,33.0,1.0,2.95,0.0,0.0,0.0,0.0,2.95,4,
2021,1048.0,FACULDADE CAMPOS ELÍSEOS,FCE,Faculdade,Privada sem fins lucrativos,SP,4.0,1.0,2.386,0.0,0.0,0.0,0.0,2.386,3,
2021,1049.0,INSTITUTO DE ENSINO SUPERIOR FUCAPI,CESF,Faculdade,Privada sem fins lucrativos,AM,9.0,1.0,2.429,0.0,0.0,0.0,0.0,2.429,3,
2021,1051.0,FACULDADE DA SEUNE,SEUNE,Faculdade,Privada com fins lucrativos,AL,4.0,1.0,2.019,0.0,0.0,0.0,0.0,2.019,3,
2021,1053.0,CENTRO UNIVERSIÁRIO UNIFTC DE FEIRA DE SANTANA,,Centro Universitário,Privada com fins lucrativos,BA,13.0,1.0,3.316,0.0,0.0,0.0,0.0,3.316,4,
2021,1055.0,Centro Universitário Maurício de Nassau de Salvador,Uninassau Salvador,Centro Universitário,Privada sem fins lucrativos,BA,22.0,1.0,2.57,0.0,0.0,0.0,0.0,2.57,3,
2021,1058.0,Centro Universitário Estácio da Bahia,Estácio Bahia,Centro Universitário,Privada com fins lucrativos,BA,32.0,1.0,2.398,0.0,0.0,0.0,0.0,2.398,3,
2021,1059.0,FACULDADE LOURENÇO FILHO,FLF,Faculdade,Privada com fins lucrativos,CE,4.0,1.0,2.162,0.0,0.0,0.0,0.0,2.162,3,
2021,1060.0,CENTRO UNIVERSITÁRIO DO INSTITUTO DE EDUCAÇÃO SUPERIOR DE BRASÍLIA - IESB,IESB,Centro Universitário,Privada com fins lucrativos,DF,37.0,0.987,3.341,0.012,4.0,0.0,0.0,3.35,4,
2021,1063.0,Faculdade Doctum de Vila Velha,DOCTUM,Faculdade,Privada sem fins lucrativos,ES,1.0,1.0,3.218,0.0,0.0,0.0,0.0,3.218,4,
2021,1064.0,Faculdade Doctum de Vitória,DOCTUM,Faculdade,Privada sem fins lucrativos,ES,3.0,1.0,3.378,0.0,0.0,0.0,0.0,3.378,4,
2021,1067.0,FACULDADE DE JUSSARA,FAJ,Faculdade,Privada com fins lucrativos,GO,3.0,1.0,2.461,0.0,0.0,0.0,0.0,2.461,3,
2021,1068.0,FACULDADE ALDETE MARIA ALVES,FAMA,Faculdade,Privada sem fins lucrativos,MG,5.0,1.0,3.168,0.0,0.0,0.0,0.0,3.168,4,
2021,1070.0,FACULDADE CNEC UNAÍ,,Faculdade,Privada sem fins lucrativos,MG,6.0,1.0,2.29,0.0,0.0,0.0,0.0,2.29,3,
2021,1075.0,CENTRO UNIVERSITÁRIO - UNIESP,UNIESP,Centro Universitário,Privada com fins lucrativos,PB,13.0,1.0,2.442,0.0,0.0,0.0,0.0,2.442,3,
2021,1076.0,"FACULDADE DE FILOSOFIA, CIÊNCIAS E LETRAS DE CAJAZEIRAS",FAFIC,Faculdade,Privada sem fins lucrativos,PB,7.0,1.0,2.282,0.0,0.0,0.0,0.0,2.282,3,
2021,1077.0,Centro Universitário Estácio do Recife,,Centro Universitário,Privada com fins lucrativos,PE,21.0,1.0,2.479,0.0,0.0,0.0,0.0,2.479,3,
2021,1078.0,CENTRO UNIVERSITÁRIO INTEGRADO DE CAMPO MOURÃO,,Centro Universitário,Privada com fins lucrativos,PR,18.0,1.0,2.735,0.0,0.0,0.0,0.0,2.735,3,
2021,1079.0,FACULDADE MARINGÁ,CESPAR,Faculdade,Privada sem fins lucrativos,PR,4.0,1.0,2.349,0.0,0.0,0.0,0.0,2.349,3,
2021,1080.0,CENTRO UNIVERSITÁRIO SÁ EARP NETO,UNIFASE,Centro Universitário,Privada sem fins lucrativos,RJ,6.0,1.0,3.503,0.0,0.0,0.0,0.0,3.503,4,
2021,1081.0,FACULDADE DE ENGENHARIA DE RESENDE,FER,Faculdade,Privada sem fins lucrativos,RJ,5.0,1.0,2.324,0.0,0.0,0.0,0.0,2.324,3,
2021,1082.0,"INSTITUTO FEDERAL DE EDUCAÇÃO, CIÊNCIA E TECNOLOGIA DO RIO GRANDE DO NORTE",IFRN,"Instituto Federal de Educação, Ciência e Tecnologia",Pública Federal,RN,25.0,0.895,2.873,0.087,4.157,0.016,4.5,3.012,4,
2021,1084.0,CENTRO UNIVERSITÁRIO CNEC DE BENTO GONÇALVES,,Centro Universitário,Privada sem fins lucrativos,RS,9.0,1.0,2.984,0.0,0.0,0.0,0.0,2.984,4,
2021,1085.0,FACULDADE METODISTA CENTENÁRIO,FMC,Faculdade,Privada sem fins lucrativos,RS,4.0,1.0,2.324,0.0,0.0,0.0,0.0,2.324,3,
2021,1087.0,CENTRO UNIVERSITÁRIO APARÍCIO CARVALHO,,Centro Universitário,Privada sem fins lucrativos,RO,20.0,1.0,2.443,0.0,0.0,0.0,0.0,2.443,3,
2021,1090.0,FACULDADE SÃO LUÍS DE FRANÇA,FSLF,Faculdade,Privada com fins lucrativos,SE,3.0,1.0,2.803,0.0,0.0,0.0,0.0,2.803,3,
2021,1092.0,FACULDADES INTEGRADAS DE BAURU,FIB,Faculdade,Privada com fins lucrativos,SP,15.0,1.0,3.019,0.0,0.0,0.0,0.0,3.019,4,
2021,1096.0,FACULDADE DE PRESIDENTE EPITÁCIO - FAPE,FAPE,Faculdade,Privada com fins lucrativos,SP,2.0,1.0,1.963,0.0,0.0,0.0,0.0,1.963,3,
2021,1100.0,Centro Universitário Carlos Drummond de Andrade,UniDrummond,Centro Universitário,Privada sem fins lucrativos,SP,11.0,1.0,2.249,0.0,0.0,0.0,0.0,2.249,3,
2021,1107.0,Centro Universitário Estácio do Ceará,Estácio Ceará,Centro Universitário,Privada com fins lucrativos,CE,39.0,1.0,2.599,0.0,0.0,0.0,0.0,2.599,3,
2021,1113.0,CENTRO UNIVERSITÁRIO EURO-AMERICANO,UNIEURO,Centro Universitário,Privada com fins lucrativos,DF,28.0,0.999,3.118,0.0,4.0,0.0,0.0,3.118,4,
2021,1115.0,FACULDADE SANTA TEREZINHA,CEST,Faculdade,Privada sem fins lucrativos,MA,7.0,1.0,2.882,0.0,0.0,0.0,0.0,2.882,3,
2021,1118.0,FACULDADE DE MIRASSOL,,Faculdade,Privada com fins lucrativos,SP,3.0,1.0,2.232,0.0,0.0,0.0,0.0,2.232,3,
2021,1120.0,"INSTITUTO FEDERAL DE EDUCAÇÃO, CIÊNCIA E TECNOLOGIA FLUMINENSE",IF Fluminense,"Instituto Federal de Educação, Ciência e Tecnologia",Pública Federal,RJ,17.0,0.939,2.771,0.06,4.143,0.0,0.0,2.855,3,
2021,1122.0,FACULDADE REGES DE OSVALDO CRUZ,,Faculdade,Privada sem fins lucrativos,SP,2.0,1.0,3.456,0.0,0.0,0.0,0.0,3.456,4,
2021,1123.0,INSTITUTO DE EDUCAÇÃO SUPERIOR UNYAHNA DE SALVADOR,IESUS,Faculdade,Privada com fins lucrativos,BA,1.0,1.0,1.683,0.0,0.0,0.0,0.0,1.683,2,
2021,1125.0,FACULDADES INTEGRADAS ESPÍRITA,FIES,Faculdade,Privada sem fins lucrativos,PR,2.0,1.0,2.87,0.0,0.0,0.0,0.0,2.87,3,
2021,1126.0,UNIVERSIDADE ESTADUAL DO CENTRO OESTE,UNICENTRO,Universidade,Pública Estadual,PR,56.0,0.791,3.368,0.137,4.308,0.071,4.5,3.578,4,
2021,1128.0,UNIVERSIDADE DE ITAÚNA,UI,Universidade,Privada sem fins lucrativos,MG,14.0,0.957,2.477,0.03,4.5,0.011,4.5,2.562,3,
2021,1129.0,CENTRO UNIVERSITÁRIO DO NORTE PAULISTA,UNORP,Centro Universitário,Privada sem fins lucrativos,SP,21.0,1.0,2.457,0.0,0.0,0.0,0.0,2.457,3,
2021,1131.0,CENTRO UNIVERSITÁRIO SANTO AGOSTINHO,UNIFSA,Centro Universitário,Privada com fins lucrativos,PI,13.0,1.0,2.736,0.0,0.0,0.0,0.0,2.736,3,
2021,1136.0,FACULDADE DE CIÊNCIAS HUMANAS E SOCIAIS DE IGARASSU,FACIG,Faculdade,Privada sem fins lucrativos,PE,5.0,1.0,1.927,0.0,0.0,0.0,0.0,1.927,2,
2021,1141.0,CENTRO UNIVERSITÁRIO GAMA E SOUZA,,Centro Universitário,Privada sem fins lucrativos,RJ,21.0,1.0,2.589,0.0,0.0,0.0,0.0,2.589,3,
2021,1142.0,FACULDADE DE DIREITO DE VITÓRIA,FDV,Faculdade,Privada com fins lucrativos,ES,1.0,0.643,3.883,0.223,5.0,0.132,5.0,4.28,5,
2021,1143.0,Faculdade de Ciências de Timbaúba,FACET,Faculdade,Privada sem fins lucrativos,PE,2.0,1.0,2.091,0.0,0.0,0.0,0.0,2.091,3,
2021,1144.0,FACULDADE DE CIÊNCIAS HUMANAS,IMENSU,Faculdade,Privada sem fins lucrativos,SP,1.0,1.0,1.323,0.0,0.0,0.0,0.0,1.323,2,
2021,1149.0,CENTRO UNIVERSITÁRIO NOSSA SENHORA DO PATROCÍNIO,CEUNSP,Centro Universitário,Privada com fins lucrativos,SP,46.0,1.0,3.289,0.0,0.0,0.0,0.0,3.289,4,
2021,1151.0,FACULDADE DE ADMINISTRAÇÃO E NEGÓCIOS DE SERGIPE,FANESE,Faculdade,Privada com fins lucrativos,SE,10.0,1.0,3.062,0.0,0.0,0.0,0.0,3.062,4,
2021,1153.0,UNIVERSIDADE CÂNDIDO MENDES,UCAM,Universidade,Privada sem fins lucrativos,RJ,51.0,0.976,2.199,0.02,4.071,0.003,4.5,2.244,3,
2021,1155.0,FACULDADE SALESIANA DE SANTA TERESA,FSST,Faculdade,Privada sem fins lucrativos,MS,2.0,1.0,1.773,0.0,0.0,0.0,0.0,1.773,2,
2021,1156.0,FACULDADE CNEC ITABORAÍ,,Faculdade,Privada sem fins lucrativos,RJ,4.0,1.0,2.587,0.0,0.0,0.0,0.0,2.587,3,
2021,1157.0,ESCOLA SUPERIOR SÃO FRANCISCO DE ASSIS,ESFA,Faculdade,Privada sem fins lucrativos,ES,4.0,1.0,1.958,0.0,0.0,0.0,0.0,1.958,3,
2021,1159.0,CENTRO DE ENSINO SUPERIOR DE VITÓRIA,CESV,Faculdade,Privada com fins lucrativos,ES,2.0,1.0,1.908,0.0,0.0,0.0,0.0,1.908,2,
2021,1160.0,Centro Universitário Cambury,UniCambury,Centro Universitário,Privada com fins lucrativos,GO,9.0,1.0,2.602,0.0,0.0,0.0,0.0,2.602,3,
2021,1161.0,INSPER INSTITUTO DE ENSINO E PESQUISA,INSPER,Faculdade,Privada sem fins lucrativos,SP,5.0,0.776,3.57,0.178,5.0,0.044,4.5,3.867,4,
2021,1166.0,"INSTITUTO FEDERAL DE EDUCAÇÃO, CIÊNCIA E TECNOLOGIA  DA PARAÍBA",IFPB,"Instituto Federal de Educação, Ciência e Tecnologia",Pública Federal,PB,23.0,0.971,2.928,0.028,4.124,0.0,0.0,2.963,4,
2021,1170.0,Centro Universitário FAMEC,UNIFAMEC,Centro Universitário,Privada com fins lucrativos,BA,10.0,1.0,2.714,0.0,0.0,0.0,0.0,2.714,3,
2021,1173.0,FACULDADE ANHANGUERA DE BRASÍLIA,,Faculdade,Privada com fins lucrativos,DF,12.0,1.0,2.415,0.0,0.0,0.0,0.0,2.415,3,
2021,1174.0,FACULDADE DE SABARÁ,SOECS,Faculdade,Privada sem fins lucrativos,MG,2.0,1.0,2.436,0.0,0.0,0.0,0.0,2.436,3,
2021,1175.0,FACULDADE ESTÁCIO DO RIO GRANDE DO SUL - ESTÁCIO FARGS,ESTÁCIO FARGS,Faculdade,Privada sem fins lucrativos,RS,4.0,1.0,2.392,0.0,0.0,0.0,0.0,2.392,3,
2021,1182.0,INSTITUTO DE ENSINO SUPERIOR DE AMERICANA,IESA,Faculdade,Privada com fins lucrativos,SP,2.0,1.0,2.992,0.0,0.0,0.0,0.0,2.992,4,
2021,1185.0,CENTRO UNIVERSITÁRIO JORGE AMADO,UNIJORGE,Centro Universitário,Privada com fins lucrativos,BA,56.0,1.0,2.986,0.0,0.0,0.0,0.0,2.986,4,
2021,1187.0,CENTRO UNIVERSITÁRIO MÓDULO,MÓDULO,Centro Universitário,Privada com fins lucrativos,SP,14.0,1.0,2.806,0.0,0.0,0.0,0.0,2.806,3,
2021,1189.0,UNIVERSIDADE DO PLANALTO CATARINENSE,UNIPLAC,Universidade,Privada sem fins lucrativos,SC,20.0,0.971,2.519,0.028,4.0,0.0,0.0,2.56,3,
2021,1190.0,FACULDADE INTEGRAL CANTAREIRA,F.I.C.,Faculdade,Privada sem fins lucrativos,SP,3.0,1.0,2.219,0.0,0.0,0.0,0.0,2.219,3,
2021,1191.0,INSTITUTO DE ENSINO SUPERIOR DE FORTALEZA,IESF,Faculdade,Privada sem fins lucrativos,CE,1.0,1.0,1.837,0.0,0.0,0.0,0.0,1.837,2,
2021,1192.0,FACULDADE DE CIÊNCIAS DA SAÚDE DE SÃO PAULO,FACIS,Faculdade,Privada com fins lucrativos,SP,1.0,,,,,,,,SC,Quantidade de matrículas igual a zero.
2021,1196.0,UNIVERSIDADE CESUMAR,UNICESUMAR,Universidade,Privada com fins lucrativos,PR,63.0,0.995,2.723,0.003,4.332,0.0,4.5,2.729,3,
2021,1198.0,FACULDADE DE CIÊNCIAS SOCIAIS E APLICADAS DO PARANÁ,FACET,Faculdade,Privada com fins lucrativos,PR,2.0,1.0,1.96,0.0,0.0,0.0,0.0,1.96,3,
2021,1201.0,FACULDADE DE ADMINISTRAÇÃO MILTON CAMPOS,FAMC,Faculdade,Privada sem fins lucrativos,MG,2.0,1.0,2.021,0.0,0.0,0.0,0.0,2.021,3,
2021,1202.0,FACULDADE SANTA RITA,FASAR,Faculdade,Privada com fins lucrativos,MG,11.0,1.0,2.474,0.0,0.0,0.0,0.0,2.474,3,
2021,1205.0,FACULDADE EDUCACIONAL DA LAPA,FAEL,Faculdade,Privada com fins lucrativos,PR,17.0,1.0,2.347,0.0,0.0,0.0,0.0,2.347,3,
2021,1208.0,FAL ESTÁCIO - FACULDADE ESTÁCIO DE NATAL,,Faculdade,Privada sem fins lucrativos,RN,5.0,1.0,2.452,0.0,0.0,0.0,0.0,2.452,3,
2021,1219.0,INSTITUTO ITAPETININGANO DE ENSINO SUPERIOR,IIES,Faculdade,Privada com fins lucrativos,SP,7.0,1.0,1.983,0.0,0.0,0.0,0.0,1.983,3,
2021,1221.0,FACULDADE GAMMON,,Faculdade,Privada sem fins lucrativos,SP,2.0,1.0,1.987,0.0,0.0,0.0,0.0,1.987,3,
2021,1224.0,CENTRO UNIVERSITÁRIO DE JALES,UNIJALES,Centro Universitário,Privada sem fins lucrativos,SP,7.0,1.0,2.317,0.0,0.0,0.0,0.0,2.317,3,
2021,1225.0,CENTRO UNIVERSITÁRIO AMPARENSE,UNIFIA,Centro Universitário,Privada com fins lucrativos,SP,14.0,1.0,2.914,0.0,0.0,0.0,0.0,2.914,3,
2021,1227.0,CENTRO UNIVERSITÁRIO SÃO FRANCISCO DE BARREIRAS,,Centro Universitário,Privada sem fins lucrativos,BA,9.0,1.0,2.623,0.0,0.0,0.0,0.0,2.623,3,
2021,1230.0,CENTRO REGIONAL UNIVERSITÁRIO DE ESPÍRITO SANTO DO PINHAL,UNIPINHAL,Centro Universitário,Privada sem fins lucrativos,SP,14.0,1.0,2.288,0.0,0.0,0.0,0.0,2.288,3,
2021,1231.0,FACULDADE CNEC SANTO ÂNGELO,,Faculdade,Privada sem fins lucrativos,RS,6.0,1.0,2.525,0.0,0.0,0.0,0.0,2.525,3,
2021,1232.0,CENTRO UNIVERSITÁRIO CAMPOS DE ANDRADE,UNIANDRADE,Centro Universitário,Privada sem fins lucrativos,PR,24.0,0.952,2.871,0.034,4.5,0.012,4.5,2.949,4,
2021,1233.0,CENTRO UNIVERSITÁRIO UNIC,,Centro Universitário,Privada com fins lucrativos,MT,9.0,1.0,2.466,0.0,0.0,0.0,0.0,2.466,3,
2021,1237.0,CENTRO UNIVERSITÁRIO NOSSA SENHORA APARECIDA,UNIFANAP,Centro Universitário,Privada sem fins lucrativos,GO,8.0,1.0,2.916,0.0,0.0,0.0,0.0,2.916,3,
2021,1239.0,FACULDADE PADRÃO,PADRAO,Faculdade,Privada com fins lucrativos,GO,1.0,1.0,2.363,0.0,0.0,0.0,0.0,2.363,3,
2021,1240.0,FACULDADE DE ESTUDOS SOCIAIS DO ESPÍRITO SANTO,PIO XII,Faculdade,Privada sem fins lucrativos,ES,6.0,1.0,2.738,0.0,0.0,0.0,0.0,2.738,3,
2021,1243.0,Faculdade Doctum de Serra,DOCTUM,Faculdade,Privada sem fins lucrativos,ES,7.0,1.0,3.016,0.0,0.0,0.0,0.0,3.016,4,
2021,1244.0,Faculdade Brasileira Multivix Vitória,MULTIVIX VITÓRIA,Faculdade,Privada com fins lucrativos,ES,15.0,1.0,3.605,0.0,0.0,0.0,0.0,3.605,4,
2021,1245.0,Faculdade de Castelo - Multivix Castelo,Multivix Castelo,Faculdade,Privada com fins lucrativos,ES,3.0,1.0,3.969,0.0,0.0,0.0,0.0,3.969,5,
2021,1247.0,FACULDADE DE CIÊNCIAS CONTÁBEIS DE NOVA ANDRADINA - FACINAN,FACINAN,Faculdade,Privada sem fins lucrativos,MS,1.0,1.0,1.964,0.0,0.0,0.0,0.0,1.964,3,
2021,1249.0,FACULDADE DE EDUCAÇÃO DE COSTA RICA,FECRA,Faculdade,Privada sem fins lucrativos,MS,2.0,1.0,1.965,0.0,0.0,0.0,0.0,1.965,3,
2021,1252.0,FACULDADE PROMOVE DE MINAS GERAIS,PROMOVE,Faculdade,Privada com fins lucrativos,MG,3.0,1.0,3.383,0.0,0.0,0.0,0.0,3.383,4,
2021,1253.0,FACULDADE METODISTA GRANBERY,FMG,Faculdade,Privada sem fins lucrativos,MG,5.0,1.0,2.746,0.0,0.0,0.0,0.0,2.746,3,
2021,1254.0,FACULDADE DE ADMINISTRAÇÃO DE ITABIRITO,FAI,Faculdade,Privada sem fins lucrativos,MG,1.0,1.0,2.245,0.0,0.0,0.0,0.0,2.245,3,
2021,1255.0,Centro Universitário FBV Wyden,UniFBV Wyden,Centro Universitário,Privada com fins lucrativos,PE,33.0,0.983,2.93,0.016,4.0,0.0,0.0,2.947,4,
2021,1256.0,FACULDADE DOM BOSCO,DOM BOSCO,Faculdade,Privada sem fins lucrativos,PR,4.0,1.0,3.043,0.0,0.0,0.0,0.0,3.043,4,
